{
  "schema_version": "mantle.function-address-binding.v1",
  "disposition": "present",
  "valid": true,
  "verdict": "PASS",
  "receipt_hash": "d8296480710f51772500d3609e2069cedfedd3b7a9140cc80633882ea91637e0",
  "claim_scope": "function_address.v1.lifecycle_policy_conformance",
  "sidecar_digest": "d06edddb8ae92cce6719c5d57b3c10f697a620f821c7e3989888a5af2855d5cf",
  "valence_receipt_digest": "0202020202020202020202020202020202020202020202020202020202020202",
  "source_archive_digest": "0404040404040404040404040404040404040404040404040404040404040404",
  "release_binary_digest": "0505050505050505050505050505050505050505050505050505050505050505",
  "kamacite_receipt_digest": "d06edddb8ae92cce6719c5d57b3c10f697a620f821c7e3989888a5af2855d5cf",
  "roles": [
    "kamacite-function-address-preserves-receipt",
    "valence-function-address-evidence-profile",
    "kamacite-function-address-json-projection"
  ],
  "schemas": [
    "kamacite.function-address-preserves-receipt.v1",
    "function-address-evidence-v1",
    "kamacite.function-address-receipt.v1"
  ],
  "mantle_non_claim_boundary": "Mantle validates bundle-local function-address evidence path, digest, role, schema, claim scope, source archive identity, binary identity, and non-claims only; Octet owns Rust extraction, Kamacite owns portable receipts, and Valence owns evidence semantics",
  "non_claim_boundary": "Cairn function-address evidence proves lifecycle policy conformance over supplied receipts only; it does not prove Rust semantic correctness, compiler correctness, build correctness, verifier soundness, or release eligibility outside the configured policy",
  "verification_summary": {
    "mode": "required",
    "required": true,
    "valid": true,
    "disposition": "present",
    "sidecar_role": "kamacite-function-address-preserves-receipt",
    "sidecar_schema": "kamacite.function-address-preserves-receipt.v1",
    "sidecar_claim_scope": "function-address-identity-linkage-only",
    "sidecar_digest_blake3": "d06edddb8ae92cce6719c5d57b3c10f697a620f821c7e3989888a5af2855d5cf",
    "valence_receipt_role": "valence-function-address-evidence-profile",
    "valence_receipt_schema": "function-address-evidence-v1",
    "valence_receipt_digest_blake3": "0606060606060606060606060606060606060606060606060606060606060606",
    "valence_receipt_hash_blake3": "0202020202020202020202020202020202020202020202020202020202020202",
    "kamacite_receipt_role": "kamacite-function-address-json-projection",
    "kamacite_receipt_schema": "kamacite.function-address-receipt.v1",
    "kamacite_receipt_digest_blake3": "870af553863f5366f2185f14767cf5f3953ac425806341ffa69f70d113510e14",
    "kamacite_receipt_hash_blake3": "d06edddb8ae92cce6719c5d57b3c10f697a620f821c7e3989888a5af2855d5cf",
    "source_archive_digest_blake3": "0404040404040404040404040404040404040404040404040404040404040404",
    "release_binary_relative_path": "binaries/mantle",
    "release_binary_digest_blake3": "0505050505050505050505050505050505050505050505050505050505050505",
    "boundary": "Mantle validates bundle-local function-address evidence path, digest, role, schema, claim scope, source archive identity, binary identity, and non-claims only; Octet owns Rust extraction, Kamacite owns portable receipts, and Valence owns evidence semantics",
    "diagnostics": []
  }
}
